{
  "user_need": "女主是古董鉴定师，出身文物修复世家，离婚时获得一箱被豪门丢弃的旧物件，其中有永乐年间官窑孤品。她要把这批破烂变成重新站起来的资本，在古董行的深水中磕磕绊绊站住脚。三条线同时作战：鉴定专业、商业谈判、法律攻防。不要鉴宝爽文，要真实成长。12万字。",
  "inspiration_state": "clear_inspiration",
  "extracted_elements": {
    "emotion_verbs": ["站起来", "磕磕绊绊", "追讨", "设局", "作战", "站住脚"],
    "scene_elements": ["古董行", "拍卖行", "豪门", "法律攻防", "商业谈判", "文物修复室", "鉴定现场"],
    "relationship_tension": [
      "前夫家法律追讨vs女主资产保卫",
      "古董行老狐狸vsv缺乏江湖经验的新人",
      "专业能力vs商业规则的矛盾",
      "造假者/设局者vs女主鉴定底线"
    ],
    "user_preferences": {
      "desired_emotion": "真实成长、压而不垮、磕磕绊绊的逆袭",
      "forbidden": [
        "鉴宝爽文/一眼辨真伪的金手指",
        "男性角色成为翻盘关键",
        "不平等的感情关系",
        "主角开挂式逆袭"
      ]
    }
  },
  "selected_recipe": {
    "x_axis_mode_id": "B12",
    "x_axis_mode_name": "获取",
    "y_axis_tags": ["商战权谋", "刑侦悬疑"],
    "reaction_strength": "↘",
    "tension_stars": 4,
    "forbidden_elements": [
      "鉴宝爽文/一眼辨真伪",
      "男性角色成为翻盘关键",
      "不平等的感情关系",
      "主角开挂式逆袭",
      "降智对手"
    ],
    "x_axis_display": "女主的每一步前进都是一场获取——跟买家谈、跟行家谈、跟前夫家律师谈、跟自己的底线谈。每次获取都有代价，每次妥协都在试探她的专业底线。古董是棋盘，人心是棋子。",
    "y_axis_combination_effect": "商战权谋提供外部博弈框架（行业竞争、法律攻防、商业谈判），刑侦悬疑提供内部认知线索（鉴定真伪、溯源流转、揭露造假），两条线交织让每一件古董都成为一场人心与专业的双重考验。",
    "reaction_formula": "B12获取模式的谈判张力 × 商战权谋的残酷博弈 × 刑侦悬疑的真伪辨析 → 每次交易都是一场战争，每件古董都藏着一个局",
    "platform_fit": ["起点女频", "晋江", "番茄"]
  },
  "one_sentence_synopsis": "离婚女鉴定师带着一箱被豪门丢弃的国宝级古董，在造假设局的古董江湖里磕磕绊绊重新站起来。"
}
