{
  "user_need": "女主古董鉴定师，出身修复世家，离婚后带走被前夫家当破烂的永乐青花罐（估价8千万）。故事讲述她如何利用这批'破烂'作为资本，在古董行立足，同时应对前夫家的法律追讨和行业内的尔虞我诈。非爽文，现实主义，势均力敌的感情线。",
  "inspiration_state": "clear_inspiration",
  "extracted_elements": {
    "emotion_verbs": ["鉴定", "博弈", "反击", "立足"],
    "scene_elements": ["古董修复室", "拍卖行", "法庭", "鬼市", "豪门家宴"],
    "relationship_tension": ["被轻视的专家 vs 傲慢的资本", "离婚夫妻的法律攻防", "行业新秀 vs 老狐狸"],
    "user_preferences": {
      "desired_emotion": "现实主义的挣扎与成长",
      "forbidden": ["金手指", "鉴宝爽文", "男性救世主"]
    }
  },
  "selected_recipe": {
    "x_axis_mode_id": "E24",
    "x_axis_mode_name": "情敌相争/阶层对抗",
    "y_axis_tags": ["商战权谋", "种田流"],
    "reaction_strength": "↗",
    "tension_stars": 4,
    "forbidden_elements": ["一眼假一眼真的神话", "霸道总裁拯救"],
    "x_axis_display": "被豪门扫地出门的'弃妇'（劣势）利用专业能力和被遗弃的宝物，对抗掌握资本和话语权的前夫家族（优势）。",
    "y_axis_combination_effect": "商战提供外部高压环境（法律、资金），种田流提供内部成长逻辑（从地摊捡漏到建立拍卖行），形成'步步为营'的节奏。",
    "reaction_formula": "阶层对抗的压迫感 + 种田经营的成就感 = 扎实的逆袭爽感",
    "platform_fit": ["现实题材", "大女主", "职场"]
  },
  "one_sentence_synopsis": "被豪门扫地出门的古董鉴定师，手握价值连城的'破烂'青花罐，在法律围剿与行业欺诈中，一步步建立属于自己的鉴宝帝国。"
}