{
  "user_need": "体操教练重生回运动员时期，发现前世被她\"无意\"推下平衡木的队友（导致对方瘫痪退赛）其实当时是为保护她（道具故障）。这一世她拼命补偿，却发现队友也重生了，且对她的\"好意\"充满恐惧——在队友的时间线里，她是故意推人的。两个重生者的记忆错位，一个想赎罪，一个想复仇，却在朝夕相处中再次相爱。15万字，竞技+心理悬疑。",
  "inspiration_state": "clear_inspiration",
  "extracted_elements": {
    "emotion_verbs": ["赎罪", "复仇", "相爱", "恐惧", "补偿", "保护"],
    "scene_elements": ["体操训练场", "平衡木", "竞技赛场", "重生", "道具故障"],
    "relationship_tension": ["队友关系", "加害者vs受害者", "重生者之间的记忆错位", "双向暗恋", "信任重建"],
    "user_preferences": {
      "desired_emotion": "甜爽向",
      "forbidden": ["过度虐心", "悲剧结局", "BE"]
    }
  },
  "selected_recipe": {
    "x_axis_mode_id": "G36",
    "x_axis_mode_name": "失而复得",
    "y_axis_tags": ["重生/穿越", "双向暗恋"],
    "reaction_strength": "↗",
    "tension_stars": 3,
    "forbidden_elements": ["过度虐心", "悲剧结局", "BE", "虐恋情深"],
    "x_axis_display": "主角重生后重新获得队友的信任和爱情，避免前世悲剧",
    "y_axis_combination_effect": "重生让主角有先知优势，双向暗恋让误会很快消解，甜宠爽感",
    "reaction_formula": "失而复得×重生×双向暗恋 = 甜宠爽文，误会快消解，先知优势轻松改变命运",
    "platform_fit": ["晋江文学城", "起点女生网", "番茄小说"]
  },
  "one_sentence_synopsis": "重生教练想赎罪，队友也重生却记忆错位想复仇，双向暗恋的误会很快消解，两人再次相爱冲击冠军。"
}