{
  "user_need": "概念：女主每天收到来自\"未来的自己\"的信，信上只有一句话\"不要爱上那个男人\"，但邮戳日期一天比一天近（从三年后→明天→今天）。最后发现信是她自己写的，在杀死他之后。\n场景：公寓（时间的密闭循环，邮箱是唯一的出口）\n物件：信纸（预言→遗书→杀人的证据）；邮戳日期（倒计时→已经发生的未来）\n疯点：女主为了验证信的真假，故意接近那个男人，却在相处中真的爱上，于是更绝望地执行杀人计划（\"为了不失去你，我必须在你离开前杀死你\"）\n单频振动：宿命论的浪漫（从抗拒→好奇→沉溺→自愿成为凶手）\n篇幅：6500-10000字",
  "inspiration_state": "clear_inspiration",
  "extracted_elements": {
    "emotion_verbs": ["宿命", "绝望", "自我实现预言", "为了不失去而毁灭", "牺牲所爱"],
    "scene_elements": ["公寓", "邮箱", "信纸", "邮戳日期", "时间循环", "密闭空间"],
    "relationship_tension": ["女主与未来的自己", "女主与男人的禁忌之爱", "爱与毁灭的悖论"],
    "user_preferences": {
      "desired_emotion": "宿命论的浪漫，虐心烧脑",
      "forbidden": []
    }
  },
  "selected_recipe": {
    "x_axis_mode_id": "D23",
    "x_axis_mode_name": "必须牺牲所爱",
    "y_axis_tags": ["规则怪谈", "第四天灾", "刑侦悬疑"],
    "reaction_strength": "✷",
    "tension_stars": 5,
    "forbidden_elements": ["不要美化杀人行为", "不要出现精神疾病诊断", "不要有救赎结局"],
    "x_axis_display": "女主为了保护爱情的纯粹性，主动选择在最美好的时刻终结关系，将爱人变成永恒的记忆而非现实的痛苦。她收到'未来自己'的警告信，试图通过验证预言来打破宿命，却在过程中成为预言的执行者。",
    "y_axis_combination_effect": "规则怪谈构建时间循环的恐怖规则（邮戳日期倒计时），第四天灾让读者意识到这是自我创造的叙事陷阱，刑侦悬疑展现女主从调查者到加害者的身份转换过程。",
    "reaction_formula": "爱情的极致不是占有而是毁灭，因为只有死亡能保证爱情永不褪色",
    "platform_fit": ["豆瓣阅读", "知乎盐选"]
  },
  "one_sentence_synopsis": "女主收到未来自己的警告信不要爱上那个男人，却在验证过程中真的爱上，最终为了保护这份爱情的纯粹性而亲手杀死他。"
}