{
  "user_need": "警察男主绑定\"犯罪预警系统\"，能在凶手额头看到倒计时。他发现未婚妻（法医）额头显示\"将在今晚23:00杀害你\"。系统提示\"不可更改\"。他必须在12小时内破解这个\"未来命案\"，同时不能让她发现他在防备她。高潮是发现她杀他的动机是为了阻止他去救一个会导致更大灾难的证人（D20为理想牺牲）。12万字，高密度悬疑。",
  "inspiration_state": "clear_inspiration",
  "extracted_elements": {
    "emotion_verbs": ["破解", "发现", "阻止", "对抗", "牺牲", "倒计时", "绝望"],
    "scene_elements": ["警察", "法医", "未婚妻", "犯罪预警系统", "倒计时", "12小时", "未来命案", "证人"],
    "relationship_tension": ["爱人与潜在凶手之间的极致矛盾", "系统规则的绝对性", "12小时紧迫时间限制", "不能让她发现的秘密行动"],
    "user_preferences": {
      "desired_emotion": "非常高密度悬疑 + 非常虐心",
      "forbidden": []
    }
  },
  "selected_recipe": {
    "x_axis_mode_id": "D20",
    "x_axis_mode_name": "为理想牺牲",
    "y_axis_tags": ["系统流", "刑侦悬疑", "双向暗恋"],
    "reaction_strength": "✷",
    "tension_stars": 5,
    "forbidden_elements": [
      "不要出现\"系统可以被打败/破解\"的机械降神结局",
      "不要让男主轻易逃避命运（否则失去虐心张力）",
      "不要写成\"其实她不是真凶\"的金手指",
      "不要有\"系统消失/失效\"的突兀转折"
    ],
    "x_axis_display": "法医未婚妻为阻止更大灾难（理想）决定杀害男主（牺牲），而\"犯罪预警系统\"的\"不可更改\"意味着命运如同神意般不可违抗，男主作为凡人必须与这绝对规则对抗",
    "y_axis_combination_effect": "系统流提供\"能看到凶手额头倒计时\"的超自然能力，但这能力同时也宣判了命运的绝对性；刑侦悬疑提供12小时紧迫的破案节奏；双向暗恋让\"未婚妻是凶手\"的冲击最大化",
    "reaction_formula": "系统流的\"命运已定\"设定 + 为理想牺牲的道德困境 = 凡人对抗绝对规则的极致挣扎",
    "platform_fit": ["起点", "晋江", "盐选"]
  },
  "one_sentence_synopsis": "绑定犯罪预警系统的警察发现未婚妻将在12小时后杀害他，系统显示\"不可更改\"，他必须在倒计时中破解未来命案，同时不能让她发现他在防备她。"
}
