{
  "user_need": "双男主，双向暗恋，玄幻题材，HE。过程要够虐，虐点主要来自外界，可以是其他人物，也可以是家族背景等设定，两人之间的故事可有小误会但不可以有大的矛盾点。10万字篇幅。故事要精彩，不能只写2人的事。",
  "inspiration_state": "clear_inspiration",
  "extracted_elements": {
    "emotion_verbs": ["暗恋", "守护", "反叛", "逆天", "牺牲"],
    "scene_elements": ["玄幻", "仙侠", "天道", "正魔对立", "命运抗争"],
    "relationship_tension": ["双向暗恋", "身份对立", "命运共同体", "外界阻挠"],
    "user_preferences": {
      "desired_emotion": "虐心但HE，双向奔赴",
      "forbidden": ["两人之间的重大矛盾", "BE结局", "背叛", "替身梗"]
    }
  },
  "selected_recipe": {
    "x_axis_mode_id": "B8",
    "x_axis_mode_name": "反叛",
    "y_axis_tags": ["双向暗恋", "仙侠修真"],
    "reaction_strength": "↘",
    "tension_stars": 5,
    "forbidden_elements": ["两人之间的重大矛盾", "BE结局", "背叛", "替身梗"],
    "x_axis_display": "两位男主作为天道选中的应劫之子，从接受命运到觉醒反抗，最终联手打破天道规则",
    "y_axis_combination_effect": "双向暗恋提供情感深度，仙侠修真提供世界观和力量体系支撑",
    "reaction_formula": "反叛(B8) × 双向暗恋 × 仙侠修真 = 逆天改命的虐恋史诗，外界压迫越重，两人情感羁绊越深",
    "platform_fit": ["耽美文学平台", "玄幻仙侠频道"]
  },
  "one_sentence_synopsis": "两位被天道选为祭品的少年，从互相试探到心意相通，最终联手打破千年宿命，改写天规。"
}
