{
  "user_need": "狂躁症男主（超忆）和抑郁症女主（失忆，每天刷新）被医生配对互相治疗（实则观察实验）。男主每天重新追求女主，女主每天重新爱上他，直到女主某天没有失忆，发现男主故意让她依赖。精神病院封闭空间，病历本/药瓶/墙上刻痕为核心物件。6500-10000字。",
  "inspiration_state": "clear_inspiration",
  "extracted_elements": {
    "emotion_verbs": ["追求", "依赖", "觉醒", "疯狂", "控制", "重新爱上"],
    "scene_elements": ["精神病院", "封闭空间", "每日重置", "白色牢笼", "墙上刻痕"],
    "relationship_tension": ["超忆vs失忆的不对等", "治疗vs实验的欺骗", "病态的纯粹爱情", "依赖vs自由意志"],
    "user_preferences": {
      "desired_emotion": "病态的纯粹（从孤独→依赖→觉醒→自愿疯狂）",
      "forbidden": ["过度美化精神疾病", "真实暴力伤害", "纯恐怖"]
    }
  },
  "selected_recipe": {
    "x_axis_mode_id": "C16",
    "x_axis_mode_name": "疯狂",
    "y_axis_tags": ["规则怪谈", "双向暗恋"],
    "reaction_strength": "↘",
    "tension_stars": 4,
    "forbidden_elements": ["不要过度美化精神疾病", "不要出现真实暴力伤害", "不要写成纯恐怖", "不要出现狗血误会拖延剧情"],
    "x_axis_display": "男主的超忆症与女主的失忆症互为镜像，医生将两个疯人配对观察。男主在疯狂中建构精密的爱情仪式，女主每日清醒的正常状态反而成了对这份爱的审判。当女主不再失忆，她必须决定：疯狂的爱是真实的，还是被制造的？",
    "y_axis_combination_effect": "精神病院的每日重置是一条怪谈规则——女主每天清空，男主每天重写。双向暗恋被扭曲：男主知道自己爱她，女主每天重新爱上他，但没有一方能确认对方的爱。规则怪谈的封闭感将精神病院变成有明确运作法则的白色牢笼。",
    "reaction_formula": "疯狂×规则怪谈 = 疯狂本身成为规则，遵守它才能存活（相爱）",
    "platform_fit": ["知乎盐选", "豆瓣阅读", "长佩"]
  },
  "one_sentence_synopsis": "精神病院里，记住一切的他每天重新追求忘记一切的她，直到她某天记起了所有。"
}