{
  "user_need": "体操教练重生回运动员时期，发现前世被她\"无意\"推下平衡木的队友（导致对方瘫痪退赛）其实当时是为保护她（道具故障）。这一世她拼命补偿，却发现队友也重生了，且对她的\"好意\"充满恐惧——在队友的时间线里，她是故意推人的。两个重生者的记忆错位，一个想赎罪，一个想复仇，却在朝夕相处中再次相爱。15万字，竞技+心理悬疑。",
  "inspiration_state": "clear_inspiration",
  "extracted_elements": {
    "emotion_verbs": ["赎罪", "复仇", "补偿", "恐惧", "相爱", "保护", "推下"],
    "scene_elements": ["体操队", "平衡木", "重生", "记忆错位", "竞技训练", "省队/国家队"],
    "relationship_tension": [
      "双重生记忆冲突：一个认为是无意事故，一个认为是蓄意推人",
      "赎罪vs复仇的对立：一个拼命补偿，一个处处提防",
      "真相第三方：道具故障背后另有黑手",
      "朝夕相处中无法控制地再次心动"
    ],
    "user_preferences": {
      "desired_emotion": "甜爽为主，悬疑为辅，不要太虐心",
      "forbidden": ["过度虐心", "BE结局", "主角降智", "感情线拖沓无进展"]
    }
  },
  "selected_recipe": {
    "x_axis_mode_id": "G36",
    "x_axis_mode_name": "失而复得",
    "y_axis_tags": ["重生/穿越", "双向暗恋", "刑侦悬疑"],
    "reaction_strength": "↗",
    "tension_stars": 4,
    "forbidden_elements": ["过度虐心", "BE结局", "主角降智", "感情线拖沓无进展"],
    "x_axis_display": "前世失去彼此（一个瘫痪退赛一个背负愧疚一生），这一世通过重生找回对方。真相揭开后发现前世悲剧是第三方设计的阴谋，两人联手找回彼此、找回真相、找回竞技梦想。",
    "y_axis_combination_effect": "重生提供先知优势和弥补遗憾的机会；双向暗恋制造'想复仇却被宠'的反差甜感；刑侦悬疑提供追查道具故障真相的推理暗线，每揭开一层真相敌意就融化一层。",
    "reaction_formula": "G36(失而复得) × [重生+双向暗恋+刑侦悬疑] = ↗ 甜爽悬疑竞技文，真相反转带来释然，冰释前嫌后的双向奔赴",
    "platform_fit": ["晋江", "长佩", "起点女生网"]
  },
  "one_sentence_synopsis": "两个记忆错位的重生体操运动员，在赎罪与复仇的拉扯中揭开前世真相，找回彼此与梦想。"
}
