{
  "user_need": "概念：女主是游戏GM（管理员），发现男主是觉醒的NPC，决定删除他以维护秩序。但在删除前夜，她进入游戏亲自体验被他爱的感觉，并故意让他杀死自己的玩家角色（\"这样你就能记住我了\"）。场景：游戏世界（数据构成的封闭场景，像素与血肉模糊边界）。物件：删除键（武器→自尽工具→婚戒）；血条（生命值→倒计时→爱的深度）。疯点：女主在玩家尸体（自己的角色）旁对NPC说\"现在你真的杀死我了，满意吗？\"单频振动：神性的坠落（从掌控→好奇→沉溺→自我毁灭）。篇幅：6500-10000字",
  "inspiration_state": "clear_inspiration",
  "extracted_elements": {
    "emotion_verbs": [
      "删除",
      "体验",
      "杀死",
      "记住",
      "维护",
      "沉溺",
      "自我毁灭"
    ],
    "scene_elements": [
      "游戏世界",
      "数据",
      "像素",
      "血肉边界",
      "删除键",
      "血条",
      "玩家尸体"
    ],
    "relationship_tension": [
      "GM vs NPC",
      "掌控者 vs 被删除者",
      "玩家 vs NPC",
      "秩序维护 vs 情感沉溺",
      "神性 vs 人性",
      "删除 vs 留恋"
    ],
    "user_preferences": {
      "desired_emotion": "虐恋、BE美学、哲学思辨、悲剧美学",
      "forbidden": []
    }
  },
  "selected_recipe": {
    "x_axis_mode_id": "D23",
    "x_axis_mode_name": "必须牺牲所爱",
    "y_axis_tags": [
      "第四天灾",
      "系统流"
    ],
    "reaction_strength": "✷",
    "tension_stars": 5,
    "forbidden_elements": [
      "不要HE结局",
      "不要轻松甜宠",
      "不要简单粗暴的救赎",
      "不要削弱GM的神性与挣扎"
    ],
    "x_axis_display": "GM林翊必须亲手删除她所爱的觉醒NPC沈渊，这是维护游戏秩序的必然要求，也是她作为'神'的职责。但删除前夜，她选择以玩家身份进入游戏，让他杀死自己，用这种方式让他永远记住她——这是她能给予的最后的爱，也是最残酷的告别。",
    "y_axis_combination_effect": "第四天灾标签让GM与NPC的关系产生Meta层面的悖论：GM既是掌控者又是玩家，NPC既是数据又是觉醒者。系统流标签强化了删除的必然性和血条的倒计时感，让'牺牲'变成可量化的残酷仪式。",
    "reaction_formula": "当'必须牺牲所爱'遇上'第四天灾'，GM的删除键既是武器也是婚戒，NPC的觉醒既是自由也是死刑，两者的碰撞产生剧烈的哲学悖论：爱一个人，就是亲手毁灭他存在的意义。",
    "platform_fit": [
      "豆瓣阅读",
      "知乎盐选",
      "长佩"
    ]
  },
  "one_sentence_synopsis": "GM林翊必须删除觉醒的NPC沈渊，却在删除前夜让他杀死自己的玩家角色，用死亡让他永远记住她。"
}