{
  "user_need": "宇航员在火星种土豆（种田流太空版），收到三年前的地球信号，发现那是他妻子在地球毁灭前发给他的告别讯息。但他发现信号里有摩斯密码附加信息：\"我在你身后\"。回头空无一人，但氧气消耗数据显示舱内多一个人。那种\"与幻觉/幽灵/时间线自己\"在封闭太空站相爱的诡异温情，3万字。",
  "inspiration_state": "clear_inspiration",
  "extracted_elements": {
    "emotion_verbs": ["相爱", "牺牲", "陪伴", "建设"],
    "scene_elements": ["火星基地", "太空种植", "地球毁灭", "信号传输", "意识上传"],
    "relationship_tension": ["生死分隔", "跨形态相守", "宇宙孤独与爱情的对抗"],
    "user_preferences": {
      "desired_emotion": "甜爽治愈，温情",
      "forbidden": ["恐怖血腥", "BE结局", "系统惩罚", "意识消散", "星际战争"]
    }
  },
  "selected_recipe": {
    "x_axis_mode_id": "D22",
    "x_axis_mode_name": "为激情牺牲一切",
    "y_axis_tags": ["种田流", "赛博朋克", "系统流"],
    "reaction_strength": "↗",
    "tension_stars": 2,
    "forbidden_elements": ["不要出现恐怖血腥画面", "不要出现系统任务惩罚", "不要让妻子的意识消散", "不要出现星际战争冲突", "不要BE结局"],
    "x_axis_display": "妻子在地球毁灭前放弃最后生存机会，将意识上传到信号中发送到火星，以系统形态陪伴男主在火星生存，两人共同建设火星家园。",
    "y_axis_combination_effect": "种田流慢节奏展示火星种植的建设感，赛博朋克的意识上传设定解释妻子跨时空存在的合理性，系统流作为妻子意识的载体，为两人的互动提供自然的接口，三者结合打造轻松甜爽的陪伴感。",
    "reaction_formula": "意识上传的妻子以种植辅助系统的形式陪伴男主，携手经营火星土豆种植基地，实现跨形态的甜蜜相守。",
    "platform_fit": ["起点", "晋江", "知乎盐选"]
  },
  "one_sentence_synopsis": "宇航员在火星种土豆时收到地球毁灭前妻子的信号，发现妻子意识变成系统，二人携手在火星开启相守生活。"
}