{
  "user_need": "故事从胡万逼六子吃凉粉的那一刻开始改写。六子没有剖腹，而是突然暴起反杀胡万，并掏出一把左轮手枪指着黄四郎的替身。原来张麻子的真名叫'约翰·马斯顿'，他来鹅城不是为了钱，是为了寻找失踪的亚瑟·摩根帮派。一场西部牛仔与民国土匪的荒诞对决。短篇（10w-15w），电影感极强，充满暴力美学与台词梗。",
  "inspiration_state": "clear_inspiration",
  "extracted_elements": {
    "emotion_verbs": [
      "寻找",
      "反杀",
      "对决"
    ],
    "scene_elements": [
      "鹅城",
      "西部牛仔",
      "左轮手枪",
      "民国",
      "死神之眼"
    ],
    "relationship_tension": [
      "牛仔精神vs土匪规矩",
      "寻找亚瑟vs对抗黄四郎",
      "六子(Lenny?)vs胡万"
    ],
    "user_preferences": {
      "desired_emotion": "荒诞、热血、暴力美学",
      "forbidden": [
        "OOC(严重偏离人设核心)",
        "低俗烂梗"
      ]
    }
  },
  "selected_recipe": {
    "x_axis_mode_id": "G35",
    "x_axis_mode_name": "复得",
    "y_axis_tags": [
      "无限流",
      "重生/穿越",
      "刑侦悬疑"
    ],
    "reaction_strength": "✷",
    "tension_stars": 5,
    "forbidden_elements": [
      "不要让约翰失去牛仔的说话风格",
      "不要弱化黄四郎的智商",
      "不要出现现代网络用语破坏年代感"
    ],
    "x_axis_display": "约翰·马斯顿在鹅城寻找失踪的亚瑟·摩根，将每一次冲突都视为寻找线索的契机。",
    "y_axis_combination_effect": "无限流解释了牛仔乱入民国的荒诞，刑侦悬疑增加了寻找亚瑟的紧迫感，重生/穿越构建了身份错位。",
    "reaction_formula": "西部牛仔逻辑暴力解构民国官场潜规则，产生剧烈的黑色幽默与暴力美学反应。",
    "platform_fit": [
      "知乎盐选",
      "起点中文网"
    ]
  },
  "one_sentence_synopsis": "约翰·马斯顿乱入鹅城取代张麻子，为寻找亚瑟·摩根，用左轮手枪在民国官场杀出一条血路。"
}