{
  "user_need": "宇航员在火星种土豆（种田流太空版），收到三年前的地球信号，发现那是他妻子在地球毁灭前发给他的告别讯息。但他发现信号里有摩斯密码附加信息：\"我在你身后\"。回头空无一人，但氧气消耗数据显示舱内多一个人。那种\"与幻觉/幽灵/时间线自己\"在封闭太空站相爱的诡异温情，3万字。",
  "inspiration_state": "clear_inspiration",
  "extracted_elements": {
    "emotion_verbs": ["解码", "相爱", "守护", "陪伴"],
    "scene_elements": ["火星基地", "封闭太空站", "种土豆", "信号接收", "摩斯密码", "氧气异常"],
    "relationship_tension": ["生死相隔", "虚实难辨", "孤独与陪伴", "理性与感性的对抗"],
    "user_preferences": {
      "desired_emotion": "甜爽治愈，诡异又温馨的同居日常",
      "forbidden": ["太虐心的情节", "BE结局", "第三者介入", "主角精神崩溃", "解释幽灵的科学原理"]
    }
  },
  "selected_recipe": {
    "x_axis_mode_id": "B11",
    "x_axis_mode_name": "谜",
    "y_axis_tags": ["种田流", "赛博朋克", "双向暗恋"],
    "reaction_strength": "↗",
    "tension_stars": 2,
    "forbidden_elements": [
      "不要详细解释\"她\"存在的科学原理",
      "不要出现第二个真人角色",
      "不要让主角精神崩溃或陷入绝望",
      "不要BE结局",
      "不要过度虐心或生离死别的煽情",
      "不要让\"她\"显形或实体化"
    ],
    "x_axis_display": "宇航员解码三年前亡妻信号中的摩斯密码，发现\"我在你身后\"——但氧气数据显示舱内确有异常消耗。是幽灵？幻觉？还是时间线错乱？解谜的过程成为两人（虚实之间）建立连接的方式。",
    "y_axis_combination_effect": "火星基地的\"高科技低生活\"种植舱成为封闭心理舞台；种田流的治愈日常为诡异氛围提供温柔缓冲；双向暗恋的酸甜感体现在——他知道她\"不该\"存在，却渴望她存在；她\"知道\"他孤独，用信号守护。",
    "reaction_formula": "解码即对话，对话即陪伴——在确认与否认之间，孤独孕育出超越时空的温柔羁绊",
    "platform_fit": ["豆瓣阅读", "知乎盐选", "晋江"]
  },
  "one_sentence_synopsis": "火星种土豆的宇航员收到亡妻三年前的信号，摩斯密码显示\"我在你身后\"，氧气数据证实舱内多一个人，他与\"不存在的人\"展开诡异又温馨的太空同居。"
}
