{
  "user_need": "写一个6500字左右的短篇，规则怪谈+双向暗恋，BE结局，女主因触发规则变成透明人，只有男主能看见她，24小时后她会回归正常但会遗忘一切",
  "inspiration_state": "clear_inspiration",
  "extracted_elements": {
    "emotion_verbs": ["遗忘", "守护", "暗恋", "失去"],
    "scene_elements": ["校园", "透明层", "24小时倒计时", "监控死角"],
    "relationship_tension": ["单向可见", "时间限制", "记忆消除", "三年暗恋"],
    "user_preferences": {
      "desired_emotion": "虐心BE",
      "forbidden": ["打破规则的外挂", "保留记忆的漏洞", "强行HE"]
    }
  },
  "selected_recipe": {
    "x_axis_mode_id": "G36",
    "x_axis_mode_name": "失去所爱",
    "y_axis_tags": ["双向暗恋", "规则怪谈"],
    "reaction_strength": "↘",
    "tension_stars": 5,
    "forbidden_elements": ["打破规则的外挂", "保留记忆的漏洞", "强行HE", "男女主死亡"],
    "x_axis_display": "24小时倒计时结束后，女主必然遗忘透明层的一切，包括男主三年的守护和刚萌生的爱意",
    "y_axis_combination_effect": "规则怪谈提供不可逆的悲剧必然性，双向暗恋在最后时刻达成却立刻被剥夺，形成极致虐心",
    "reaction_formula": "失去所爱 × (双向暗恋 + 规则怪谈) = 刚确认心意就被迫遗忘的BE美学",
    "platform_fit": ["番茄小说", "晋江", "长佩"]
  },
  "one_sentence_synopsis": "她终于看见了暗恋她三年的透明人，却只有24小时，然后她会忘记他存在过。"
}